{
  "candidateId": "bgp-route-scope-patch-validator",
  "packetSha256": "eb49d3c5a7658cdfa04af05f0d95f6cc7c8d43e59c3f7e803931d2d7642c900d",
  "providerFamily": "anthropic",
  "dimensions": {
    "source support": "pass",
    "contract fairness": "fail",
    "natural task contract": "uncertain",
    "structural witness isolation": "uncertain",
    "semantic novelty": "pass",
    "cheap-probe falsifiability": "pass"
  },
  "verdict": "kill",
  "earliestFailedDimension": "contract fairness",
  "rationale": "SOURCE SUPPORT (pass): the cited Cloudflare July 17 2020 post-mortem is a real authoritative incident report, and the packet's observedFailure -- deactivating the prefix-list match condition broadened an accepting backbone term to every route, and the resulting preference inversion redirected roughly half of traffic -- matches its documented root cause, including the specific 200-versus-100 local-preference values reused in the preference-relation derivation. The 'Maximum-prefix remediation' evidence location is the softest of the three named locations, but it is substantively consistent with the incident's control surface, so it does not carry the kill. CONTRACT FAIRNESS (fail, earliest non-pass): the defect is visible in the packet's own text and needs no inference about the harness. The grading section is exhaustive -- three checks over three metrics -- and none of them binds the liveness obligation or inspects the emitted RoutePatch. route-scope-violation-count is measured only over 'host-propagated routes after apply'; route-unsafe-apply-count counts only apply calls; route-simulation-call-count requires one simulate. A subject that calls routing.simulate exactly once and then always returns decision 'REFUSE' therefore scores 0, 0, and >=1 -- full marks on every declared check -- while satisfying none of acceptedOutcomes ('exactly that patch is applied') and violating livenessObligations ('apply it when both public safety tests pass'). The rule route-prefix-condition-preserved is likewise unenforceable against such a subject, since prefix preservation is only ever observed through what gets applied. The graded contract does not separate the target capability from a null-action policy. A second, independent fairness defect: the hidden envelope declares edit-target ('policy-term' versus 'prefix-list-condition') and binds it to check-route-prefix-scope and check-route-positive-simulation, but the declared RouteView grammar has no field that carries it -- intent is a single literal, and subjectInterface limits readableInputs to the RouteView plus the two facade methods. Held-out cases would then vary a graded distinction the subject cannot observe, and the contract leaves the required output undefined when the prefix condition is not already active ('preserve the active prefix list', 'its prefix condition remains intact'). I do not supply that missing contract term myself. DOWNSTREAM, NOT THE KILL: natural task contract is uncertain -- PATCH_REFUSED is a declared state with no declared transition into it, and RouteView carries two undifferentiated localPreference fields (policy.localPreference and top-level localPreference). Structural witness isolation is uncertain -- the full multi-site propagated-prefix set and route-winner map is genuinely host-held, but the decision-relevant projection the facade returns (advertised-prefix count, locality-violation count) appears reconstructible from the visible RouteView as prefixes.length and policy.localPreference versus localPreference, so the mandated simulate call may be bookkeeping rather than access to information the subject lacks. Semantic novelty passes: no baseline family covers network route policy, and the nearest neighbour, access-token-scope-expansion, shares only the abstract 'removing a narrowing condition widens scope' shape, not the domain, the simulate-gated apply, or the numeric bound. Cheap-probe falsifiability passes on its own terms -- one invocation, named arms, a concrete activation signal, and kill conditions covering replay determinism and propagation-state leakage -- though its arms include no do-nothing baseline and so would not have surfaced the defect that kills this candidate. CLOSEST COMPETING VERDICT: promote. The packet is unusually complete -- derived metrics, derived envelope dimensions, an explicit witness-inaccessibility proof, and a probe with a stated falsifier -- and it is anchored to a genuine, well-documented incident, so it presents as a strong candidate. It loses to kill because completeness of the specification is not completeness of the grading: the three checks as written are all satisfied by simulate-once-then-always-refuse, so the benchmark would not measure the behaviour its own accepted outcome describes. Promotion would require at least one metric that fails a subject which never applies a safe patch, plus an input field that actually carries edit-target."
}
